{
  "id": "gmail_secrets_sf",
  "name": "gmail secrets sf",
  "description": "Define Gmail OAuth2 credentials for demo flows.",
  "tasks": [
    {
      "id": "vars.gmail_secrets",
      "name": "vars gmail secrets",
      "description": "Set OAuth2 credentials and addresses for Gmail API flows.",
      "action": "VARIABLES",
      "scope": "flow",
      "overwrite": true,
      "vars": [
        {
          "name": "google_client_id",
          "type": "string",
          "value": "your-client-id.apps.googleusercontent.com"
        },
        {
          "name": "google_client_secret",
          "type": "string",
          "value": "your-client-secret"
        },
        {
          "name": "gmail_refresh_token",
          "type": "string",
          "value": "your-refresh-token"
        },
        {
          "name": "gmail_from",
          "type": "string",
          "value": "sender@example.com"
        },
        {
          "name": "gmail_to",
          "type": "string",
          "value": "recipient@example.com"
        }
      ]
    }
  ]
}
